Ad_Number,Headline_1,Headline_2,Headline_3,Description_1,Description_2,Final_URL_Path_1,Final_URL_Path_2
1,Brand Strategy Alternative,Save $14500 vs Agency,Same Quality Faster Results,Get the same frameworks top brand agencies use. 95% more affordable. Instant implementation.,Why pay $15K for what you can get in 30 minutes? Professional strategy accessible pricing.,/vs-agency,/pricing
2,Affordable Brand Consultant,AI + Expert Frameworks,No $50K Agency Fees,Professional brand consulting without the agency price tag. Get started for $49.,Same strategic frameworks. Personalized recommendations. Ready-to-use templates.,/consultant,/get-started
3,Brand Agency Alternative,Professional Strategy $149/mo,Used by 10000+ Businesses,Get agency-quality brand strategy at fraction of the cost. No contracts required.,Expert positioning frameworks. AI-powered insights. Instant implementation. Try free.,/alternative,/free-trial
4,Skip the Brand Agency,Get Strategy in 30 Minutes,Save Time and Money,Why wait months and pay $50K? Get professional brand strategy today.,Same proven frameworks. Personalized to your business. Instant access to templates.,/skip-agency,/assessment
5,Branding Without Agency,Expert Frameworks + AI,$49 vs $15000,Professional brand strategy shouldn't cost $15K. Get the same quality for less.,Used by startups marketing teams and agencies. Trusted by 10000+ businesses.,/no-agency,/pricing
6,Brand Strategist Online,Accessible Expert Guidance,Fraction of Agency Cost,Get the brand strategist you need at the price you can afford.,Professional positioning frameworks. Personalized strategy. Implementation templates.,/strategist,/platform
7,Agency-Quality Strategy,Without Agency Prices,AI-Powered Brand Platform,Don't compromise on quality. Compromise on price. Professional strategy accessible to all.,Same frameworks consultants use. Delivered in minutes not months. Start free.,/quality,/get-started
8,Replace Brand Agency,With Smart AI Platform,Save $40K+ Per Year,Agencies charge $50K for brand strategy. We charge $149/month. Same quality results.,Get unlimited assessments frameworks templates and support. No contracts.,/replace-agency,/pricing
9,Brand Consulting Online,Professional at Your Pace,No Agency Required,Get expert brand consulting without agency fees timelines or complexity.,Strategic frameworks. AI-powered recommendations. Ready-to-implement assets.,/consulting,/assessment
10,Affordable Branding Expert,Same Frameworks $49-$149,Not $10K-$50K,Why pay agency prices for frameworks you can access yourself?,Professional brand strategy made accessible. Join 10000+ smart businesses.,/affordable,/platform
11,Brand Strategy Service,Faster Than Any Agency,Professional Quality Guaranteed,Get comprehensive brand strategy in 30 minutes. Agencies take months.,Expert frameworks. Personalized insights. Implementation tools. Start free today.,/service,/free-trial
12,Online Brand Strategist,Available 24/7 On-Demand,No Agency Waiting,Access professional brand strategy whenever you need it. No appointments required.,AI-powered platform with expert frameworks. Used by founders worldwide.,/online,/get-started
13,Brand Development Firm,Alternative for Startups,Professional Affordable Fast,Get the strategic foundation without the agency investment.,Same quality. Fraction of time. Fraction of cost. Professional results.,/development,/pricing
14,Marketing Agency Alt,Just Brand Strategy Part,Specialized Affordable,Get focused brand strategy without paying for full-service agency.,Expert positioning frameworks and implementation tools. Nothing you don't need.,/marketing-alt,/assessment
15,Professional Brand Help,Without Professional Fees,Smart Business Choice,Smart businesses get professional help at smart prices. Join 10000+ on Brandora.,Agency-quality frameworks. Startup-friendly pricing. Enterprise features available.,/help,/platform
