Tweet_Number,Format,Tweet_Text,Media_Type,CTA,Target_Audience
1,Single Tweet,"Hot take: Most startups spend $50K on marketing before spending $50 on brand strategy. Then wonder why nothing works. Fix the foundation first. brandora.com/assessment",Image: Foundation before building,Visit Site,Startup founders marketing interested
2,Single Tweet,"Your competitor just raised $2M. Same product. Same market. Only difference? Crystal-clear brand positioning that investors understood immediately. Get yours: brandora.com",Image: Clear vs unclear positioning,Learn More,Startup founders entrepreneurs
3,Thread,"🧵 The 3 questions every successful brand answers: 1/ Who values what you do most? (Not everyone. Your specific ideal customer.) 2/ What makes you genuinely different? (Not features. Unique combination competitors can't copy.) 3/ Why should they choose you? (Specific compelling reason.) Most founders can't answer these clearly. Brandora helps you discover your answers in 30min. Professional frameworks. AI-powered insights. Start free: brandora.com/assessment",No media (text thread),Start Assessment,Founders entrepreneurs business owners
4,Poll Tweet,"Quick poll for founders: How much would you pay for professional brand strategy? A) $0 (DIY it) B) $500-$1000 C) $5000-$10000 D) $15000+ (Reply with your budget and why) PS: Brandora delivers agency-quality strategy for $49-$149 → brandora.com",Poll graphic,Vote Now,Startup community followers
5,Single Tweet,"Brand strategy isn't: • Your logo • Your colors • Your fonts Brand strategy IS: • Your positioning • Your differentiation • Your messaging Get it right: brandora.com/platform",Image: Is vs Isn't comparison,Explore Platform,Marketing professionals
6,Single Tweet,"We analyzed 10000+ brand strategies. The ones that succeed all start with three questions. Want to know what they are? Take our free 30-min assessment: brandora.com/assessment",Image: Question marks to lightbulbs,Take Assessment,Entrepreneurs founders
7,Video Tweet,"Why do some products with identical features win while others struggle? Brand positioning. Customers don't buy the best product. They buy the one they understand best. Clear positioning wins every time. Get yours: brandora.com [30-second explainer video]",30-sec video,Watch More,Marketing professionals
8,Single Tweet,"Agencies charge $15K for brand strategy. Templates cost $0 but give you nothing. Brandora: Professional frameworks + AI insights = $49-$149. The obvious choice: brandora.com/pricing",Image: Price comparison chart,See Pricing,Budget-conscious founders
9,Thread,"Unpopular opinion: You don't have a marketing problem. You have a positioning problem. 🧵 If your ads aren't converting... If your website has high bounce rate... If sales calls go nowhere... If customers don't get your value... It's not your marketing tactics. It's your strategic foundation. Fix positioning first. Everything else gets easier. Try Brandora free: brandora.com",No media (text thread),Get Started,Marketing frustrated founders
10,Carousel Tweet,"5 signs you need brand strategy: 1️⃣ You compete on price not value 2️⃣ Your team explains your brand differently 3️⃣ Website visitors don't convert 4️⃣ You sound like your competitors 5️⃣ You can't explain your difference clearly Sound familiar? Fix it in 30min: brandora.com/assessment",Carousel: 5 cards with each sign,Start Free,Founders business owners
11,Single Tweet,"Most founders: Spend months building product ✅ Spend weeks on website design ✅ Spend 0 hours on brand strategy ❌ Then wonder why marketing doesn't work Smart founders: Start with strategy. brandora.com",Image: Checklist with strategy checked,Learn More,Startup founders
12,Single Tweet,"'We saved $14500 on brand strategy.' - Marcus Founder TechCo How? Brandora instead of agency. Same quality frameworks. AI-powered insights. 30 minutes not 3 months. Your turn: brandora.com/pricing",Image: Testimonial quote graphic,See How,Cost-conscious entrepreneurs
13,Video Tweet,"From confused positioning to funded startup in 90 days. Sarah's story: [60-second founder testimonial] 'Brandora helped us get crystal clear. Investors loved it.' Watch her full story: brandora.com/case-studies",60-sec video testimonial,Read Story,Fundraising founders
14,Single Tweet,"Brand positioning quiz: Which sounds clearer? A) 'We help businesses grow through innovative solutions' B) 'We help SaaS companies reduce churn by 40% through AI-powered customer insights' B is positioning. A is noise. Learn to craft yours: brandora.com/assessment",Image: A vs B comparison,Take Quiz,Marketing professionals
15,Single Tweet,"If you're marketing without clear brand positioning you're: • Confusing customers ✘ • Wasting ad spend ✘ • Competing on price ✘ • Making marketing harder ✘ Fix the foundation: brandora.com/platform",Image: X marks vs checkmarks,Get Started,Marketers founders
16,Thread,"Thread: Why your brand positioning is probably wrong (and how to fix it) 🧵 1/ You're trying to appeal to everyone 2/ You're listing features not benefits 3/ You sound exactly like competitors 4/ You can't explain your difference in one sentence 5/ Your team doesn't have shared understanding The fix? Professional brand strategy frameworks. Used to cost $15K+. Now accessible to everyone: brandora.com Professional positioning in 30 minutes. Start free.",No media (text thread),Start Now,Founders marketing teams
17,Single Tweet,"'Best brand investment we made this year.' - Jennifer Marketing Director See why 10000+ businesses chose Brandora for professional brand strategy. From $49. Try free: brandora.com/platform",Image: 5-star rating testimonial,Try Free,Marketing directors managers
18,Carousel Tweet,"Brand strategy ROI: Swipe for what you get with Brandora → 1. Clear positioning statement 2. Target audience definition 3. Competitive differentiation 4. Messaging framework 5. 50+ implementation templates Value: $15K+ from agency Cost: $49-$149 Start: brandora.com",Carousel: 5 cards showing deliverables,Get Started,ROI-focused marketers
19,Single Tweet,"Your marketing tech stack: Email: $200/mo CRM: $150/mo Ads: $5000/mo Brand strategy: $0 ❌ This is backwards. Fix your foundation for $149/mo: brandora.com/pricing",Image: Tech stack pyramid,See Pricing,Marketing teams SaaS
20,Video Tweet,"See Brandora in action: [15-second platform demo] ✓ AI-powered assessment ✓ Personalized strategy ✓ Ready-to-use templates ✓ 30 minutes to clarity Try free: brandora.com/assessment",15-sec platform demo,Start Free,Consideration stage prospects
